fold_id,pdf_name
0,Unsupervised Contrastive Learning of Image Representations from Ultrasound Videos with Hard Negative Mining
0,Robust Segmentation of Brain MRI in the Wild with Hierarchical CNNs and No Retraining
0,Deep Laparoscopic Stereo Matching with Transformers
0,Anomaly-Aware Multiple Instance Learning for Rare Anemia Disorder Classification
0,RTN: Reinforced Transformer Network for Coronary CT Angiography Vessel-level Image Quality Assessment
0,Deep Motion Network for Freehand 3D Ultrasound Reconstruction
0,A Spatiotemporal Model for Precise and Efficient Fully-Automatic 3D Motion Correction in OCT
0,Carbon Footprint of Selecting and Training Deep Learning Models for Medical Image Analysis
0,LiftReg: Limited Angle 2D 3D Deformable Registration
0,AutoLaparo: A New Dataset of Integrated Multi-tasks for Image-guided Surgical Automation in Laparoscopic Hysterectomy
0,Conditional Deformable Image Registration with Convolutional Neural Network
0,Adversarial Learning of Cancer Tissue Representations
0,Distilling Effective Supervision for Robust Medical Image Segmentation with Noisy Labels
0,Using Causal Analysis for Conceptual Deep Learning Explanation
0,Unsupervised Representation Learning Meets Pseudo-Label Supervised Self-Distillation: A New Approach to Rare Disease Classification
0,Joint Motion Correction and Super Resolution for Cardiac Segmentation via Latent Optimisation
0,Combining Attention-Based Multiple Instance Learning and Gaussian Processes for CT Hemorrhage Detection
0,Deep Attentive Wasserstein Generative Adversarial Networks for MRI Reconstruction with Recurrent Context-Awareness
0,Edge-Variational Graph Convolutional Networks for Uncertainty-Aware Disease Prediction
0,Reinforcement Learning of Musculoskeletal Control from Functional Simulations
0,AutoSNAP: Automatically Learning Neural Architectures for Instrument Pose Estimation
0,Automatic and Interpretable Model for Periodontitis Diagnosis in Panoramic Radiographs
0,From Connectomic to Task-Evoked Fingerprints: Individualized Prediction of Task Contrasts from Resting-State Functional Connectivity
0,Active MR k-space Sampling with Reinforcement Learning
0,Few-Shot Anomaly Detection for Polyp Frames from Colonoscopy
0,Evaluation of Retinal Image Quality Assessment Networks in Different Color-Spaces
0,Fully Convolutional Boundary Regression for Retina OCT Segmentation
0,Cone-Beam Computed Tomography (CBCT) Segmentation by Adversarial Learning Domain Adaptation
0,Learning Interpretable Features via Adversarially Robust Optimization
0,Detection and Correction of Cardiac MRI Motion Artefacts During Reconstruction from k-space
0,Estimating Reference Bony Shape Model for Personalized Surgical Reconstruction of Posttraumatic Facial Defects
0,A Multiresolution Convolutional Neural Network with Partial Label Training for Annotating Reflectance Confocal Microscopy Images of Skin
0,Nonparametric Density Flows for MRI Intensity Normalisation
0,Quasi-automatic Colon Segmentation on T2-MRI Images with Low User Effort
0,Instance Segmentation and Tracking with Cosine Embeddings and Recurrent Hourglass Networks
0,Analysis of Morphological Changes of Lamina Cribrosa Under Acute Intraocular Pressure Change
0,Mean Field Network Based Graph Refinement with Application to Airway Tree Extraction
0,Improving Whole Slide Segmentation Through Visual Context - A Systematic Study
0,Joint Reconstruction and Segmentation of 7T-like MR Images from 3T MRI Based on Cascaded Convolutional Neural Networks
0,Semi-supervised Deep Learning for Fully Convolutional Networks
0,QuaSI: Quantile Sparse Image Prior for Spatio-Temporal Denoising of Retinal OCT Data
0,Ultrasonic Needle Tracking with a Fibre-Optic Ultrasound Transmitter for Guidance of Minimally Invasive Fetal Surgery
0,Automatic 3D Cardiovascular MR Segmentation with Densely-Connected Volumetric ConvNets
0,Deep Retinal Image Understanding
0,Deep Learning for Multi-task Medical Image Segmentation in Multiple Modalities
0,Accounting for the Confound of Meninges in Segmenting Entorhinal and Perirhinal Cortices in T1-Weighted MRI
0,A Statistical Model for Smooth Shapes in Kendall Shape Space
0,A 2D-3D Registration Framework for Freehand TRUS-Guided Prostate Biopsy
0,DeepOrgan: Multi-level Deep Convolutional Networks for Automated Pancreas Segmentation
0,Improved Parkinson’s Disease Classification from Diffusion MRI Data by Fisher Vector Descriptors
0,Fast Background Removal in 3D Fluorescence Microscopy Images Using One-Class Learning
0,Introducing Interactive Inverse FEM Simulation and Its Application for Adaptive Radiotherapy
0,Longitudinal Measurement of the Developing Thalamus in the Preterm Brain Using Multi-modal MRI
0,CTA Coronary Labeling through Efficient Geodesics between Trees Using Anatomy Priors
0,Time-Warped Geodesic Regression
0,Sparse Appearance Learning Based Automatic Coronary Sinus Segmentation in CTA
0,A Probabilistic Approach to Quantification of Melanin and Hemoglobin Content in Dermoscopy Images
0,Needle Guidance Using Handheld Stereo Vision and Projection for Ultrasound-Based Interventions
0,Automatic Method for Thalamus Parcellation Using Multi-modal Feature Classification
0,Segmentation Based Denoising of PET Images: An Iterative Approach via Regional Means and Affinity Propagation
0,Spatially Aware Cell Cluster(SpACCl) Graphs: Predicting Outcome in Oropharyngeal p16+ Tumors
0,Fully Automatic X-Ray Image Segmentation via Joint Estimation of Image Displacements
0,Genetic Clustering on the Hippocampal Surface for Genome-Wide Association Studies
0,Predictive Models of Resting State Networks for Assessment of Altered Functional Connectivity in MCI
0,Manifold Regularized Multi-Task Feature Selection for Multi-Modality Classification in Alzheimer’s Disease
0,High-Order Graph Matching Based Feature Selection for Alzheimer’s Disease Identification
0,Semi-Supervised and Active Learning for Automatic Segmentation of Crohn’s Disease
0,Measurement of Myelin in the Preterm Brain: Multi-compartment Diffusion Imaging and Multi-component T2 Relaxometry
0,Automated CT Segmentation of Diseased Hip Using Hierarchical and Conditional Statistical Shape Models
0,Random Walks with Adaptive Cylinder Flux Based Connectivity for Vessel Segmentation
0,Improving Explainability of Disentangled Representations using Multipath-Attribution Mappings
0,Towards IID representation learning and its application on biomedical data
0,Learned Half-Quadratic Splitting Network for MR Image Reconstruction
0,Learning Morphological Feature Perturbations for Calibrated Semi-Supervised Segmentation
0,Benefits of Linear Conditioning for Segmentation using Metadata
0,Explainable Image Quality Analysis of Chest X-Rays
0,Digitally Stained Confocal Microscopy through Deep Learning
1,TINC: Temporally Informed Non-contrastive Learning for Disease Progression Modeling in Retinal OCT Volumes
1,Test Time Transform Prediction for Open Set Histopathological Image Recognition
1,Automated Classification of General Movements in Infants Using Two-Stream Spatiotemporal Fusion Network
1,INSightR-Net: Interpretable Neural Network for Regression Using Similarity-Based Comparisons to Prototypical Examples
1,Layer Ensembles: A Single-Pass Uncertainty Estimation in Deep Learning for Segmentation
1,InsMix: Towards Realistic Generative Data Augmentation for Nuclei Instance Segmentation
1,Local Attention Graph-Based Transformer for Multi-target Genetic Alteration Prediction
1,XMorpher: Full Transformer for Deformable Medical Image Registration via Cross Attention
1,UNeXt: MLP-Based Rapid Medical Image Segmentation Network
1,OLVA: Optimal Latent Vector Alignment for Unsupervised Domain Adaptation in Medical Image Segmentation
1,SA-GAN: Structure-Aware GAN for Organ-Preserving Synthetic CT Generation
1,LensID: A CNN-RNN-Based Framework Towards Lens Irregularity Detection in Cataract Surgery Videos
1,A Principled Approach to Failure Analysis and Model Repairment: Demonstration in Medical Imaging
1,Real-Time Mapping of Tissue Properties for Magnetic Resonance Fingerprinting
1,Multiple Instance Learning with Auxiliary Task Weighting for Multiple Myeloma Classification
1,A Spherical Convolutional Neural Network for White Matter Structure Imaging via dMRI
1,A Multi-attribute Controllable Generative Model for Histopathology Image Synthesis
1,Task-Oriented Low-Dose CT Image Denoising
1,SAR: Scale-Aware Restoration Learning for 3D Tumor Segmentation
1,TransCT: Dual-Path Transformer for Low Dose Computed Tomography
1,Vascular Surface Segmentation for Intracranial Aneurysm Isolation and Quantification
1,Microtubule Tracking in Electron Microscopy Volumes
1,Foveation for Segmentation of Mega-Pixel Histology Images
1,Supervised Multi-topology Network Cross-Diffusion for Population-Driven Brain Network Atlas Estimation
1,A Physics-Informed Geometric Learning Model for Pathological Tau Spread in Alzheimer’s Disease
1,Domain Adaptation for Ultrasound Beamforming
1,Deep Q-Network-Driven Catheter Segmentation in 3D US by Hybrid Constrained Semi-supervised Learning and Dual-UNet
1,Cross-domain Medical Image Translation by Shared Latent Gaussian Mixture Model
1,3D Cardiac Shape Prediction with Deep Neural Networks: Simultaneous Use of Images and Patient Metadata
1,Unsupervised Clustering of Quantitative Imaging Phenotypes Using Autoencoder and Gaussian Mixture Model
1,Conditional Segmentation in Lieu of Image Registration
1,Synthetic Patches Real Images: Screening for Centrosome Aberrations in EM Images of Human Cancer Cells
1,3DQ: Compact Quantized Neural Networks for Volumetric Whole Brain  Segmentation
1,Uncertainty Guided Semi-supervised Segmentation of Retinal Layers in OCT Images
1,Tubular Structure Segmentation Using Spatial Fully Connected Network with Radial Distance Loss for 3D Medical Images
1,Fully Automated Pancreas Segmentation with Two-Stage 3D Convolutional Neural Networks
1,Multiple Instance Learning for Heterogeneous Images: Training a CNN for Histopathology
1,Using the Anisotropic Laplace Equation to Compute Cortical Thickness
1,Cost-Sensitive Active Learning for Intracranial Hemorrhage Detection
1,DeepASL: Kinetic Model Incorporated Loss for Denoising Arterial Spin Labeled MRI via Deep Residual Learning
1,Generative Discriminative Models for Multivariate Inference and Statistical Mapping in Medical Imaging
1,Left Ventricle Segmentation via Optical-Flow-Net from Short-Axis Cine MRI: Preserving the Temporal Coherence of Cardiac Motion
1,Multimodal Fusion of Brain Networks with Longitudinal Couplings
1,Graph-Constrained Sparse Construction of Longitudinal Diffusion-Weighted Infant Atlases
1,Developmental Patterns Based Individualized Parcellation of Infant Cortical Surface
1,UV Exposed Optical Fibers with Frequency Domain Reflectometry for Device Tracking in Intra-arterial Procedures
1,Discovering Cortical Folding Patterns in Neonatal Cortical Surfaces Using Large-Scale Dataset
1,Compressed Sensing Dynamic MRI Reconstruction Using GPU-accelerated 3D Convolutional Sparse Coding
1,Barycentric Subspace Analysis: A New Symmetric Group-Wise Paradigm for Cardiac Motion Tracking
1,Prior-Based Coregistration and Cosegmentation
1,Prediction of Trabecular Bone Anisotropy from Quantitative Computed Tomography Using Supervised Learning and a Novel Morphometric Feature Descriptor
1,Surrogate-Driven Estimation of Respiratory Motion and Layers in X-Ray Fluoroscopy
1,Estimating Large Lung Motion in COPD Patients by Symmetric Regularised Correspondence Fields
1,Vito – A Generic Agent for Multi-physics Model Personalization: Application to Heart Modeling
1,Combining Unsupervised Feature Learning and Riesz Wavelets for Histopathology Image Representation: Application to Identifying Anaplastic Medulloblastoma
1,Multi-atlas Based Segmentation Editing with Interaction-Guided Constraints
1,Regenerative Random Forest with Automatic Feature Selection to Detect Mitosis in Histopathological Breast Cancer Images
1,A Steering Engine: Learning 3-D Anatomy Orientation Using Regression Forests
1,Application of L0-Norm Regularization to Epicardial Potential Reconstruction
1,Towards Automatic Bone Age Estimation from MRI: Localization of 3D Anatomical Landmarks
1,A New Sensor Technology for 2D Ultrasound-Guided Needle Tracking
1,A Fully Bayesian Inference Framework for Population Studies of the Brain Microstructure
1,Hierarchical Bayesian Modeling Estimation and Sampling for Multigroup Shape Analysis
1,Interventional Digital Tomosynthesis from a Standard Fluoroscopy System Using 2D-3D Registration
1,A Cross-Sectional Piecewise Constant Model for Segmenting Highly Curved Fiber Tracts in Diffusion MR Images
1,Tissue-Specific Sparse Deconvolution for Low-Dose CT Perfusion
1,Non-Rigid 2D-3D Registration Using Anisotropic Error Ellipsoids to Account for Projection Uncertainties during Aortic Surgery
1,Implications of Inconsistencies between fMRI and dMRI on Multimodal Connectivity Estimation
1,Adaptively Constrained Convex Optimization for Accurate Fiber Orientation Estimation with High Order Spherical Harmonics
1,Visual Phrase Learning and Its Application in Computed Tomographic Colonography
1,EfficientCellSeg: Efficient Volumetric Cell Segmentation Using Context Aware Pseudocoloring
1,Direct Inference of Cell Positions using Lens-Free Microscopy and Deep Learning
1,Embedding-based Instance Segmentation in Microscopy
1,Guided Filter Regularization for Improved Disentanglement of Shape and Appearance in Diffeomorphic Autoencoders
1,An Auxiliary Task for Learning Nuclei Segmentation in 3D Microscopy Images
1,Exploring local rotation invariance in 3D CNNs with steerable filters
1,A novel segmentation framework for uveal melanoma in magnetic resonance imaging based on class activation maps
2,Adaptive Multi-scale Online Likelihood Network for AI-assisted  Interactive Segmentation
2,Dual-Branch Squeeze-Fusion-Excitation Module for Cross-Modality Registration of Cardiac SPECT and CT
2,Weighted Concordance Index Loss-Based Multimodal Survival Modeling for Radiation Encephalopathy Assessment in Nasopharyngeal Carcinoma Radiotherapy
2,Attentive Symmetric Autoencoder for Brain MRI Segmentation
2,Atlas-Powered Deep Learning (ADL) - Application to Diffusion Weighted MRI
2,Morphology-Aware Interactive Keypoint Estimation
2,Lesion-Aware Contrastive Representation Learning for Histopathology Whole Slide Images Analysis
2,One-Shot Segmentation of Novel White Matter Tracts via Extensive Data Augmentation
2,Fast Unsupervised Brain Anomaly Detection and Segmentation with Diffusion Models
2,Orientation-Guided Graph Convolutional Network for Bone Surface Segmentation
2,Lesion Guided Explainable Few Weak-Shot Medical Report Generation
2,Poisson2Sparse: Self-supervised Poisson Denoising from a Single Image
2,Transformer Lesion Tracker
2,Developmental Stage Classification of Embryos Using Two-Stream Neural Network with Linear-Chain Conditional Random Field
2,Text2Brain: Synthesis of Brain Activation Maps from Free-Form Text Query
2,LambdaUNet: 2.5D Stroke Lesion Segmentation of Diffusion-Weighted MR Images
2,Detection of Critical Structures in Laparoscopic Cholecystectomy Using Label Relaxation and Self-supervision
2,RibSeg Dataset and Strong Point Cloud Baselines for Rib Segmentation from CT Scans
2,Self Domain Adapted Network
2,Multi-organ Segmentation via Co-training Weight-Averaged Models from Few-Organ Datasets
2,T2 Mapping from Super-Resolution-Reconstructed Clinical Fast Spin Echo Magnetic Resonance Acquisitions
2,Ultrasound Video Summarization Using Deep Reinforcement Learning
2,Anatomical Data Augmentation via Fluid-Based Image Registration
2,Adversarial Uni- and Multi-modal Stream Networks for Multimodal Image Registration
2,Automatic Data Augmentation for 3D Medical Image Segmentation
2,DeepPrognosis: Preoperative Prediction of Pancreatic Cancer Survival and Surgical Margin via Contrast-Enhanced CT Imaging
2,Adaptive Image-Feature Learning for Disease Classification Using Inductive Graph Networks
2,Cephalometric Landmark Detection by Attentive Feature Pyramid Fusion and Regression-Voting
2,Automated Surgical Activity Recognition with One Labeled Sequence
2,Using 3D Convolutional Neural Networks to Learn Spatiotemporal Features for Automatic Surgical Gesture Recognition in Video
2,PRSNet: Part Relation and Selection Network for Bone Age Assessment
2,Disease Knowledge Transfer Across Neurodegenerative Diseases
2,SegNAS3D: Network Architecture Search with Derivative-Free Global Optimization for 3D Image Segmentation
2,Needle Tip Force Estimation Using an OCT Fiber and a Fused convGRU-CNN Architecture
2,Pulse Sequence Resilient Fast Brain Segmentation
2,Estimating Achilles Tendon Healing Progress with Convolutional Neural Networks
2,Y-Net: Joint Segmentation and Classification for Diagnosis of Breast Biopsy Images
2,Initialize Globally Before Acting Locally: Enabling Landmark-Free 3D US to MRI Registration
2,Inherent Brain Segmentation Quality Control from Fully ConvNet Monte Carlo Sampling
2,Group-Driven Reinforcement Learning for Personalized mHealth Intervention
2,Multi-label Inductive Matrix Completion for Joint MGMT and IDH1 Status Prediction for Glioma Patients
2,Unbiased Shape Compactness for Segmentation
2,Generalised Coherent Point Drift for Group-Wise Registration of Multi-dimensional Point Sets
2,Direct Detection of Pixel-Level Myocardial Infarction Areas via a Deep-Learning Algorithm
2,Full Quantification of Left Ventricle via Deep Multitask Learning Network Respecting Intra- and Inter-Task Relatedness
2,Hyperbolic Space Sparse Coding with Its Application on Prediction of Alzheimer’s Disease in Mild Cognitive Impairment
2,Joint Segmentation and CT Synthesis for MRI-only Radiotherapy Treatment Planning
2,Hierarchical Shape Distributions for Automatic Identification of 3D Diastolic Vortex Rings from 4D Flow MRI
2,Projection-Based Phase Features for Localization of a Needle Tip in 2D Curvilinear Ultrasound
2,Computational Sonography
2,Registration of Color and OCT Fundus Images Using Low-dimensional Step Pattern Analysis
2,Co-restoring Multimodal Microscopy Images
2,Cortical Surface-Based Construction of Individual Structural Network with Application to Early Brain Development Study
2,Automatic Graph-Based Localization of Cochlear Implant Electrodes in CT
2,Structured Decision Forests for Multi-modal Ultrasound Image Registration
2,Mobile C-arm 3D Reconstruction in the Presence of Uncertain Geometry
2,Learning the Correlation Between Images and Disease Labels Using Ambiguous Learning
2,Computer-Aided Infarction Identification from Cardiac CT Images: A Biomechanical Approach with SVM
2,Coupled Sparse Dictionary for Depth-Based Cup Segmentation from Single Color Fundus Image
2,A Novel Structure-Aware Sparse Learning Algorithm for Brain Imaging Genetics
2,Optimally Stabilized PET Image Denoising Using Trilateral Filtering
2,Topo-Geometric Filtration Scheme for Geometric Active Contours and Level Sets: Application to Cerebrovascular Segmentation
2,Augmented Reality Assisted Laparoscopic Partial Nephrectomy
2,Advanced Transcatheter Aortic Valve Implantation (TAVI) Planning from CT with ShapeForest
2,BrainPrint : Identifying Subjects by Their Brain
2,Gaussian Process Interpolation for Uncertainty Estimation in Image Registration
2,A Novel Multi-relation Regularization Method for Regression and Classification in AD Diagnosis
2,Combining Surface and Fiber Geometry: An Integrated Approach to Brain Morphology
2,Low-Rank Total Variation for Image Super-Resolution
2,Automated Segmentation of CBCT Image Using Spiral CT Atlases and Convex Optimization
2,Transformer-based out-of-distribution detection for clinically safe segmentation
2,FBNETGEN: Task-aware GNN-based fMRI Analysis via Functional Brain Network Generation
2,Discrete Pseudohealthy Synthesis: Aortic Root Shape Typification and Type Classification with Pathological Prior
2,4D Semantic Cardiac Magnetic Resonance Image Synthesis on XCAT Anatomical Model
2,Locating Cephalometric X-Ray Landmarks with Foveated Pyramid Attention
2,Deep Reinforcement Learning for Organ Localization in CT
2,SAU-Net: Efficient 3D Spine MRI Segmentation Using Inter-Slice Attention
3,Class Impression for Data-Free Incremental Learning
3,Learning Robust Representation for Joint Grading of Ophthalmic Diseases via Adaptive Curriculum and Feature Disentanglement
3,Fusing Modalities by Multiplexed Graph Neural Networks for Outcome Prediction in Tuberculosis
3,Learning Underrepresented Classes from Decentralized Partially Labeled Medical Images
3,Towards Confident Detection of Prostate Cancer Using High Resolution Micro-ultrasound
3,SUPER-IVIM-DC: Intra-voxel Incoherent Motion Based Fetal Lung Maturity Assessment from Limited DWI Data Using Supervised Learning Coupled with Data-Consistency
3,What Makes for Automatic Reconstruction of Pulmonary Segments
3,A Self-guided Framework for Radiology Report Generation
3,MUSCLE: Multi-task Self-supervised Continual Learning to Pre-train Deep Models for X-Ray Images of Multiple Body Parts
3,Landmark-Free Statistical Shape Modeling Via Neural Flow Deformations
3,Unsupervised Deformable Image Registration with Absent Correspondences in Pre-operative and Post-recurrence Brain Tumor MRI Scans
3,4D-OR: Semantic Scene Graphs for OR Domain Modeling
3,Noise2SR: Learning to Denoise from Super-Resolved Single Noisy Fluorescence Image
3,ChrSNet: Chromosome Straightening Using Self-attention Guided Networks
3,Data-Driven Mapping Between Functional Connectomes Using Optimal Transport
3,Lung Cancer Risk Estimation with Incomplete Data: A Joint Missing Imputation Perspective
3,Self-Supervised Lesion Change Detection and Localisation in Longitudinal Multiple Sclerosis Brain Imaging
3,Uncertainty-Guided Progressive GANs for Medical Image Translation
3,Medical Matting: A New Perspective on Medical Segmentation with Uncertainty
3,Non-invasive Assessment of Hepatic Venous Pressure Gradient (HVPG) Based on MR Flow Imaging and Computational Fluid Dynamics
3,Categorical Relation-Preserving Contrastive Knowledge Distillation for Medical Image Classification
3,Continual Learning with Bayesian Model Based on a Fixed Pre-trained Feature Extractor
3,Anatomy-Constrained Contrastive Learning for Synthetic Segmentation Without Ground-Truth
3,Self-supervised Discovery of Anatomical Shape Landmarks
3,Automated Intracranial Artery Labeling Using a Graph Neural Network and Hierarchical Refinement
3,Estimating Tissue Microstructure with Undersampled Diffusion Data via Graph Convolutional Neural Networks
3,Learning and Reasoning with the Graph Structure Representation in Robotic Surgery
3,Interpretation of Disease Evidence for Medical Images Using Adversarial Deformation Fields
3,Joint Left Atrial Segmentation and Scar Quantification Based on a DNN with Spatial Encoding and Shape Attention
3,Scientific Discovery by Generating Counterfactuals Using Image Translation
3,Prostate Motion Modelling Using Biomechanically-Trained Deep Neural Networks on Unstructured Nodes
3,Difficulty-Aware Glaucoma Classification with Multi-rater Consensus Modeling
3,Deep Learning Within a Priori Temporal Feature Spaces for Large-Scale Dynamic MR Image Reconstruction: Application to 5-D Cardiac MR Multitasking
3,Fast and Scalable Optimal Transport for Brain Tractograms
3,X-Net: Brain Stroke Lesion Segmentation Based on Depthwise Separable Convolution and Long-Range Dependencies
3,Decompose-and-Integrate Learning for Multi-class Segmentation in Medical Images
3,Towards Whole Placenta Segmentation at Late Gestation Using Multi-view Ultrasound Images
3,SPNet: Shape Prediction Using a Fully Convolutional Neural Network
3,Unsupervised Domain Adaptation for Automatic Estimation of Cardiothoracic Ratio
3,Adversarial Similarity Network for Evaluating Image Alignment in Deep Learning Based Registration
3,Weakly Supervised Representation Learning for Endomicroscopy Image Analysis
3,Dynamic Field Mapping and Motion Correction Using Interleaved Double Spin-Echo Diffusion MRI
3,Maximum Mean Discrepancy Based Multiple Kernel Learning for Incomplete Multimodality Neuroimaging Data
3,Scalable Unsupervised Domain Adaptation for Electron Microscopy
3,Learning-Based Multimodal Image Registration for Prostate Cancer Radiation Therapy
3,Longitudinal Analysis of the Preterm Cortex Using Multi-modal Spectral Matching
3,Spatiotemporal Parsing of Motor Kinematics for Assessing Stroke Recovery
3,Positive Delta Detection for Alpha Shape Segmentation of 3D Ultrasound Images of Pathologic Kidneys
3,Elucidating Intravoxel Geometry in Diffusion-MRI: Asymmetric Orientation Distribution Functions (AODFs) Revealed by a Cone Model
3,Segmentation of Infant Hippocampus Using Common Feature Representations Learned for Multimodal Longitudinal Data
3,Sparse Bayesian Inference of White Matter Fiber Orientations from Compressed Multi-resolution Diffusion MRI
3,V–Bundles: Clustering Fiber Trajectories from Diffusion MRI in Linear Time
3,Simultaneous Denoising and Registration for Accurate Cardiac Diffusion Tensor Reconstruction from MRI
3,Interventional Photoacoustic Imaging of the Human Placenta with Ultrasonic Tracking for Minimally Invasive Fetal Surgeries
3,Semantic 3-D Labeling of Ear Implants Using a Global Parametric Transition Prior
3,Modeling the Variability in Brain Morphology and Lesion Distribution in Multiple Sclerosis by Deep Learning
3,Sparse Bayesian Registration
3,Registering Cortical Surfaces Based on Whole-Brain Structural Connectivity and Continuous Connectivity Analysis
3,Constructing 4D Infant Cortical Surface Atlases Based on Dynamic Developmental Trajectories of the Cortex
3,Semi-automated Query Construction for Content-Based Endomicroscopy Video Retrieval
3,Efficient Total Variation Algorithm for Fetal Brain MRI Reconstruction
3,Fisher Kernel Based Task Boundary Retrieval in Laparoscopic Database with Single Video Query
3,IntellEditS: Intelligent Learning-Based Editor of Segmentations
