fold_id,pdf_name
19,TumorCP: A Simple but Effective Object-Level Data Augmentation for Tumor Segmentation
19,Tractogram Filtering of Anatomically Non-plausible Fibers with Geometric Deep Learning
19,Hierarchical Bayesian Regression for Multi-site Normative Modeling of Neuroimaging Data
19,Scribble2Label: Scribble-Supervised Cell Segmentation via Self-generating Pseudo-Labels with Consistency
19,Non-Rigid Volume to Surface Registration Using a Data-Driven Biomechanical Model
19,Image-Level Harmonization of Multi-site Data Using Image-and-Spatial Transformer Networks
19,Improve Bone Age Assessment by Learning from Anatomical Local Regions
19,Double-Uncertainty Weighted Method for Semi-supervised Learning
19,Leveraging Undiagnosed Data for Glaucoma Classification with Teacher-Student Learning
19,U-ReSNet: Ultimate Coupling of Registration and Segmentation with Deep Nets
19,LumiPath – Towards Real-Time Physically-Based Rendering on Embedded Devices
19,Hierarchical Parcellation of the Cerebellum
19,Assessing Reliability and Challenges of Uncertainty Estimations for Medical Image Segmentation
19,Improved Inference via Deep Input Transfer
19,Automatic Segmentation of Vestibular Schwannoma from T2-Weighted MRI by Deep Spatial Attention with Hardness-Weighted Loss
19,Uncertainty-Aware Self-ensembling Model for Semi-supervised 3D Left Atrium Segmentation
19,Cardiac Segmentation from LGE MRI Using Deep Neural Network Incorporating Shape and Spatial Priors
19,Multi-scale Coarse-to-Fine Segmentation for Screening Pancreatic Ductal Adenocarcinoma
19,Generative Invertible Networks (GIN): Pathophysiology-Interpretable Feature Mapping and Virtual Patient Generation
19,Domain and Geometry Agnostic CNNs for Left Atrium Segmentation in 3D Ultrasound
19,A Tetrahedron-Based Heat Flux Signature for Cortical Thickness Morphometry Analysis
19,Automated Performance Assessment in Transoesophageal Echocardiography with Convolutional Neural Networks
19,Tract Orientation Mapping for Bundle-Specific Tractography
19,Craniomaxillofacial Bony Structures Segmentation from MRI with Deep-Supervision Adversarial Learning
19,Neighborhood Matching for Curved Domains with Application to Denoising in Diffusion MRI
19,A Variational Approach to Sparse Model Error Estimation in Cardiac Electrophysiological Imaging
19,A Multi-armed Bandit to Smartly Select a Training Set from Big Medical Data
19,Multimodal Hyper-connectivity Networks for MCI Classification
19,Adaptable Landmark Localisation: Applying Model Transfer Learning to a Shape Model Matching System
19,Deep Multi-task Multi-channel Learning for Joint Classification and Regression of Brain Status
19,Suggestive Annotation: A Deep Active Learning Framework for Biomedical Image Segmentation
19,Riemannian Statistical Analysis of Cortical Geometry with Robustness to Partial Homology and Misalignment
19,Crowd-Algorithm Collaboration for Large-Scale Endoscopic Image Annotation with Confidence
19,Comprehensive Maximum Likelihood Estimation of Diffusion Compartment Models Towards Reliable Mapping of Brain Microstructure
19,Tight Graph Framelets for Sparse Diffusion MRI q-Space Representation
19,Automatic in Vivo Cell Detection in MRI
19,Analysis of High-throughput Microscopy Videos: Catching Up with Cell Dynamics
19,A Landmark-Based Approach for Robust Estimation of Exposure Index Values in Digital Radiography
19,Flexible Reconstruction and Correction of Unpredictable Motion from Stacks of 2D Images
19,An Iterated Complex Matrix Approach for Simulation and Analysis of Diffusion MRI Processes
19,Learning-Based Shape Model Matching: Training Accurate Models with Minimal Manual Input
19,Analytic Quantification of Bias and Variance of Coil Sensitivity Profile Estimators for Improved Image Reconstruction in MRI
19,Computer-Aided Pulmonary Embolism Detection Using a Novel Vessel-Aligned Multi-planar Image Representation and Convolutional Neural Networks
19,Group-Wise Functional Community Detection through Joint Laplacian Diagonalization
19,2D 3D Registration of TEE Probe from Two Non-orthogonal C-Arm Directions
19,From Expected Propagator Distribution to Optimal Q-space Sample Metric
19,Full-Wave Intravascular Ultrasound Simulation from Histology
19,Co-occurrence of Local Anisotropic Gradient Orientations (CoLlAGe): Distinguishing Tumor Confounders and Molecular Subtypes on MRI
19,Segmentation of Multiple Knee Bones from CT for Orthopedic Knee Surgery Planning
19,Patient-Specific Biomechanical Modeling of Ventricular Enlargement in Hydrocephalus from Longitudinal Magnetic Resonance Imaging
19,Non-rigid 2D-3D Medical Image Registration Using Markov Random Fields
19,Efficient Phase Contrast Microscopy Restoration Applied for Muscle Myotube Detection
19,A Probabilistic Non-parametric Framework for Inter-modality Label Fusion
19,Multiple Sclerosis Lesion Segmentation Using Dictionary Learning and Sparse Coding
19,Comparing representations of biological data learned with different AI paradigms augmenting and cropping strategies
19,Unseen Disease Detection for Deep Learning Interpretation of Chest X-rays
19,A Mean-Field Variational Inference Approach to Deep Image Prior for Inverse Problems in Medical Imaging
19,DRMIME: Differentiable Mutual Information and Matrix Exponential for Multi-Resolution Image Registration
19,On Direct Distribution Matching for Adapting Segmentation Networks
19,Brain Metastasis Segmentation Network Trained with Robustness to Annotations with Multiple False Negatives
20,Free Lunch for Surgical Video Understanding by Distilling Self-supervisions
20,Localizing the Recurrent Laryngeal Nerve via Ultrasound with a Bayesian Shape Framework
20,SD-LayerNet: Semi-supervised Retinal Layer Segmentation in OCT Using Disentangled Representation with Anatomical Priors
20,BMD-GAN: Bone Mineral Density Estimation Using X-Ray Image Decomposition into Projections of Bone-Segmented Quantitative Computed Tomography Using Hierarchical Learning
20,ULTRA: Uncertainty-Aware Label Distribution Learning for Breast Tumor Cellularity Assessment
20,Trichomonas Vaginalis Segmentation in Microscope Images
20,Assessing the Performance of Automated Prediction and Ranking of Patient Age from Chest X-rays Against Clinicians
20,Mesh-Based 3D Motion Tracking in Cardiac MRI Using Deep Learning
20,Surgical-VQA: Visual Question Answering in Surgical Scenes Using Transformer
20,Conditional Generative Data Augmentation for Clinical Audio Datasets
20,Rethinking Surgical Instrument Segmentation: A Background Image Can Be All You Need
20,Learning Self-calibrated Optic Disc and Cup Segmentation from Multi-rater Annotations
20,Recurrent Multigraph Integrator Network for Predicting the Evolution of Population-Driven Brain Connectivity Templates
20,SurgeonAssist-Net: Towards Context-Aware Head-Mounted Display-Based Augmented Reality for Surgical Guidance
20,Phase-Independent Latent Representation for Cardiac Shape Analysis
20,Semi-supervised Contrastive Learning for Label-Efficient Medical Image Segmentation
20,Multi-compound Transformer for Accurate Biomedical Image Segmentation
20,Generative Self-training for Cross-Domain Unsupervised Tagged-to-Cine MRI Synthesis
20,VinDr-SpineXR: A Deep Learning Framework for Spinal Lesions Detection and Classification from Radiographs
20,Cross-Modal Attention for MRI and Ultrasound Volume Registration
20,Sli2Vol: Annotate a 3D Volume from a Single Slice with Self-supervised Learning
20,Anatomy of Domain Shift Impact on U-Net Layers in MRI Segmentation
20,Positive-Unlabeled Learning for Cell Detection in Histopathology Images with Incomplete Annotations
20,SALAD: Self-supervised Aggregation Learning for Anomaly Detection on X-Rays
20,StyPath: Style-Transfer Data Augmentation for Robust Histology Image Classification
20,An Analysis by Synthesis Method that Allows Accurate Spatial Modeling of Thickness of Cortical Bone from Clinical QCT
20,Data-Driven Multi-contrast Spectral Microstructure Imaging with InSpect
20,Fluid Registration Between Lung CT and Stationary Chest Tomosynthesis Images
20,Uncertainty-Guided Efficient Interactive Refinement of Fetal Brain Segmentation from Stacks of MRI Slices
20,Learning Shape Representation on Sparse Point Clouds for Volumetric Image Segmentation
20,Confident Head Circumference Measurement from Ultrasound with Real-Time Feedback for Sonographers
20,Brain Segmentation from k-Space with End-to-End Recurrent Attention Network
20,Overfitting of Neural Nets Under Class Imbalance: Analysis and Improvements for Segmentation
20,Deep Instance-Level Hard Negative Mining Model for Histopathology Images
20,CompareNet: Anatomical Segmentation Network with Deep Non-local Label Fusion
20,3DFPN-HS $$^2$$ 2 : 3D Feature Pyramid Network Based High Sensitivity and Specificity Pulmonary Nodule Detection
20,A Mixed-Supervision Multilevel GAN Framework for Image Quality Enhancement
20,Automated Lesion Detection by Regressing Intensity-Based Distance with a Neural Network
20,Robust Cochlear Modiolar Axis Detection in CT
20,Solving the Cross-Subject Parcel Matching Problem Using Optimal Transport
20,Deep Multi-structural Shape Analysis: Application to Neuroanatomy
20,Omni-Supervised Learning: Scaling Up to Large Unlabelled Medical Datasets
20,Brain Decoding from Functional MRI Using Long Short-Term Memory Recurrent Neural Networks
20,Adversarial Sparse-View CBCT Artifact Reduction
20,Spatiotemporal Segmentation and Modeling of the Mitral Valve in Real-Time 3D Echocardiographic Images
20,Bayesian Image Quality Transfer with CNNs: Exploring Uncertainty in dMRI Super-Resolution
20,Automatic Labeling of Vascular Structures with Topological Constraints via HMM
20,Orientation-Sensitive Overlap Measures for the Validation of Medical Image Segmentations
20,Motion Compensated Abdominal Diffusion Weighted MRI by Simultaneous Image Registration and Model Estimation (SIR-ME)
20,A Machine Learning Based Approach to Fiber Tractography Using Classifier Voting
20,Uncertainty-Driven Forest Predictors for Vertebra Localization and Segmentation
20,Multi-scale Heat Kernel Based Volumetric Morphology Signature
20,Automatic Coronary Calcium Scoring in Cardiac CT Angiography Using Convolutional Neural Networks
20,Multi-scale and Multimodal Fusion of Tract-Tracing Myelin Stain and DTI-derived Fibers in Macaque Brains
20,Towards Personalized Interventional SPECT-CT Imaging
20,Robust Registration of Longitudinal Spine CT
20,Towards Automatic Plan Selection for Radiotherapy of Cervical Cancer by Fast Automatic Segmentation of Cone Beam CT Scans
20,The Empirical Variance Estimator for Computer Aided Diagnosis: Lessons for Algorithm Validation
20,Complete Set of Invariants of a 4 th Order Tensor: The 12 Tasks of HARDI from Ternary Quartics
20,3D Global Estimation and Augmented Reality Visualization of Intra-operative X-ray Dose
20,Automatic Clustering and Thickness Measurement of Anatomical Variants of the Human Perirhinal Cortex
20,String Motif-Based Description of Tool Motion for Detecting Skill and Gestures in Robotic Surgery
20,Robust Multimodal Dictionary Learning
20,Superpixel Classification Based Optic Cup Segmentation
20,A Metamorphosis Distance for Embryonic Cardiac Action Potential Interpolation and Classification
20,3-D Operation Situs Reconstruction with Time-of-Flight Satellite Cameras Using Photogeometric Data Fusion
20,Surface Smoothing: A Way Back in Early Brain Morphogenesis
20,A Learning-Based Approach for Fast and Robust Vessel Tracking in Long Ultrasound Sequences
20,A Generative Model for OCT Retinal Layer Segmentation by Integrating Graph-Based Multi-surface Searching and Image Registration
20,Constructive Real Time Feedback for a Temporal Bone Simulator
20,Self-Supervised Transformers for fMRI representation
20,The OOD Blind Spot of Unsupervised Anomaly Detection
20,Cluster-to-Conquer: A Framework for End-to-End Multi-Instance Learning for Whole Slide Image Classification
20,Automatic Diagnosis of Pulmonary Embolism Using an Attention-guided Framework: A Large-scale Study
20,Capturing Single-Cell Phenotypic Variation via Unsupervised Representation Learning
20,XLSor: A Robust and Accurate Lung Segmentor on Chest X-Rays Using Criss-Cross Attention and Customized Radiorealistic Abnormalities Generation
21,Self-Ensembling Vision Transformer (SEViT) for Robust Medical Image Classification
21,Supervised Contrastive Learning to Classify Paranasal Anomalies in the Maxillary Sinus
21,Unsupervised Representation Learning of Cingulate Cortical Folding Patterns
21,Deep Learning-Based Facial Appearance Simulation Driven by Surgically Planned Craniomaxillofacial Bony Movement
21,Unsupervised Domain Adaptive Fundus Image Segmentation with Category-Level Regularization
21,Global Multi-modal 2D 3D Registration via Local Descriptors Learning
21,Gigapixel Whole-Slide Images Classification Using Locally Supervised Learning
21,Multi-frame Attention Network for Left Ventricle Segmentation in 3D Echocardiography
21,EndoUDA: A Modality Independent Segmentation Approach for Endoscopy Imaging
21,Inter Extreme Points Geodesics for End-to-End Weakly Supervised Image Segmentation
21,Efficient Neural Network Approximation of Robust PCA for Automated Analysis of Calcium Imaging Data
21,Dual-Consistency Semi-supervised Learning with Uncertainty Quantification for COVID-19 Lesion Segmentation from CT Images
21,Projection-Wise Disentangling for Fair and Interpretable Representation Learning: Application to 3D Facial Shape Analysis
21,Deep Neural Dynamic Bayesian Networks Applied to EEG Sleep Spindles Modeling
21,Efficient Semi-supervised Gross Target Volume of Nasopharyngeal Carcinoma Segmentation via Uncertainty Rectified Pyramid Consistency
21,Efficient and Generic Interactive Segmentation Framework to Correct Mispredictions During Clinical Evaluation of Medical Images
21,Shallow Attention Network for Polyp Segmentation
21,Interactive Segmentation via Deep Learning and B-Spline Explicit Active Surfaces
21,Multi-frame Collaboration for Effective Endoscopic Video Polyp Detection via Spatial-Temporal Feature Transformation
21,3d-SMRnet: Achieving a New Quality of MPI System Matrix Recovery by Deep Learning
21,Topology-Aware Generative Adversarial Network for Joint Prediction of Multiple Brain Graphs from a Single Brain Graph
21,Automatic CAD-RADS Scoring Using Deep Learning
21,Multimodal Latent Semantic Alignment for Automated Prostate Tissue Classification and Retrieval
21,JBFnet - Low Dose CT Denoising by Trainable Joint Bilateral Filtering
21,User-Guided Domain Adaptation for Rapid Annotation from User Interactions: A Study on Pathological Liver Segmentation
21,Statistical Atlas of C. elegans Neurons
21,Endotracheal Tube Detection and Segmentation in Chest Radiographs Using Synthetic Data
21,Multi Scale Curriculum CNN for Context-Aware Breast MRI Malignancy Classification
21,Anatomical Priors for Image Segmentation via Post-processing with Denoising Autoencoders
21,Synthesis and Inpainting-Based MR-CT Registration for Image-Guided Thermal Ablation of Liver Tumors
21,Unsupervised Standard Plane Synthesis in Population Cine MRI via Cycle-Consistent Adversarial Networks
21,Automatic View Planning with Multi-scale Deep Reinforcement Learning Agents
21,Semi-supervised Learning for Segmentation Under Semantic Constraint
21,Colon Shape Estimation Method for Colonoscope Tracking Using Recurrent Neural Networks
21,Joint Learning of Motion Estimation and Segmentation for Cardiac MR Image Sequences
21,SLSDeep: Skin Lesion Segmentation Based on Dilated Residual and Pyramid Pooling Networks
21,Deep Adversarial Context-Aware Landmark Detection for Ultrasound Imaging
21,Using Convolutional Neural Networks to Automatically Detect Eye-Blink Artifacts in Magnetoencephalography Without Resorting to Electrooculography
21,Robust Non-rigid Registration Through Agent-Based Action Learning
21,Distance Metric Learning Using Graph Convolutional Networks: Application to Functional Brain Networks
21,CardiacNET: Segmentation of Left Atrium and Proximal Pulmonary Veins from MRI Using Multi-view CNN
21,3D U-Net: Learning Dense Volumetric Segmentation from Sparse Annotation
21,A Bayesian Model to Assess $$T_2$$ Values and Their Changes Over Time in Quantitative MRI
21,Riemannian Metric Optimization for Connectivity-Driven Surface Mapping
21,Automated Segmentation of Knee MRI Using Hierarchical Classifiers and Just Enough Interaction Based Learning: Data from Osteoarthritis Initiative
21,Automatic Cystocele Severity Grading in Ultrasound by Spatio-Temporal Regression
21,Direct Estimation of Wall Shear Stress from Aneurysmal Morphology: A Statistical Approach
21,Predictive Modeling of Anatomy with Genetic and Clinical Data
21,Bayesian Personalization of Brain Tumor Growth Model
21,Structural Edge Detection for Cardiovascular Modeling
21,Robust Transmural Electrophysiological Imaging: Integrating Sparse and Dynamic Physiological Models into ECG-Based Inference
21,Distance Networks for Morphological Profiling and Characterization of DICCCOL Landmarks
21,3D Deep Learning for Efficient and Robust Landmark Detection in Volumetric Data
21,Multi-scale Analysis of Imaging Features and Its Use in the Study of COPD Exacerbation Susceptible Phenotypes
21,Genus-One Surface Registration via Teichmüller Extremal Mapping
21,Hole Detection in Metabolic Connectivity of Alzheimer’s Disease Using k −Laplacian
21,Computer Assisted Planning and Navigation of Periacetabular Osteotomy with Range of Motion Optimization
21,Maximum-Margin Based Representation Learning from Multiple Atlases for Alzheimer’s Disease Classification
21,Longitudinal Alignment of Disease Progression in Fibrosing Interstitial Lung Disease
21,Direct Estimation of Cardiac Bi-ventricular Volumes with Regression Forests
21,Max-Margin Based Learning for Discriminative Bayesian Network from Neuroimaging Data
21,SEEG Trajectory Planning: Combining Stability Structure and Scale in Vessel Extraction
21,Analysis of Trabecular Bone Microstructure Using Contour Tree Connectivity
21,Persistent Homological Sparse Network Approach to Detecting White Matter Abnormality in Maltreated Children: MRI and DTI Multimodal Study
21,Exhaustive Search of the SNP-SNP Interactome Identifies Epistatic Effects on Brain Volume in Two Cohorts
21,Anatomy-Guided Discovery of Large-Scale Consistent Connectivity-Based Cortical Landmarks
21,Spatio-temporal Dimension Reduction of Cardiac Motion for Group-Wise Analysis and Statistical Testing
21,Contrast-Independent Liver-Fat Quantification from Spectral CT Exams
21,Integration of Sparse Multi-modality Representation and Geometrical Constraint for Isointense Infant Brain Segmentation
21,Real-Time Respiratory Motion Analysis Using Manifold Ray Casting of Volumetrically Fused Multi-view Range Imaging
21,Semi-Supervised Medical Image Segmentation via Cross Teaching between CNN and Transformer
21,Survival Analysis for Idiopathic Pulmonary Fibrosis using CT Images and Incomplete Clinical Data
21,Whole-Body Soft-Tissue Lesion Tracking and Segmentation in Longitudinal CT Imaging Studies
21,Fast Mitochondria Detection for Connectomics
21,Boundary loss for highly unbalanced segmentation
21,Prediction of Disease Progression in Multiple Sclerosis Patients using Deep Learning Analysis of MRI Data
22,Incremental Learning for Heterogeneous Structure Segmentation in Brain Tumor MRI
22,Merging-Diverging Hybrid Transformer Networks for Survival Prediction in  Head and Neck Cancer
22,Automatic Segmentation of Hip Osteophytes in DXA Scans Using U-Nets
22,Visual Deep Learning-Based Explanation for Neuritic Plaques Segmentation in Alzheimer’s Disease Using Weakly Annotated Whole Slide Histopathological Images
22,Non-iterative Coarse-to-Fine Registration Based on Single-Pass Deep Cumulative Learning
22,A Deep-Discrete Learning Framework for Spherical Surface Registration
22,Reducing Positional Variance in Cross-sectional Abdominal CT Slices with Deep Conditional Generative Models
22,UTNet: A Hybrid Transformer Architecture for Medical Image Segmentation
22,Generalised Super Resolution for Quantitative MRI Using Self-supervised Mixture of Experts
22,SimTriplet: Simple Triplet Representation Learning with a Single GPU
22,Microscopic Fine-Grained Instance Classification Through Deep Attention
22,Renal Cell Carcinoma Detection and Subtyping with Minimal Point-Based Annotation in Whole-Slide Images
22,Deep Graph Normalizer: A Geometric Deep Learning Approach for Estimating Connectional Brain Templates
22,DISCo: Deep Learning Instance Segmentation and Correlations for Cell Segmentation in Calcium Imaging
22,A Macro-Micro Weakly-Supervised Framework for AS-OCT Tissue Segmentation
22,Recognition of Instrument-Tissue Interactions in Endoscopic Videos via Action Triplets
22,Simultaneous Estimation of X-Ray Back-Scatter and Forward-Scatter Using Multi-task Learning
22,E$$^2$$Net: An Edge Enhanced Network for Accurate Liver and Tumor Segmentation on CT Scans
22,Learning Motion Flows for Semi-supervised Instrument Segmentation from Robotic Surgical Video
22,Learning Cross-Modal Deep Representations for Multi-Modal MR Image Segmentation
22,Automatic Segmentation of Muscle Tissue and Inter-muscular Fat in Thigh and Calf MRI Images
22,DiamondGAN: Unified Multi-modal Generative Adversarial Networks for MRI Sequences Synthesis
22,One Network to Segment Them All: A General Lightweight System for Accurate 3D Medical Image Segmentation
22,Revealing Developmental Regionalization of Infant Cerebral Cortex Based on Multiple Cortical Properties
22,Two-Stream CNN with Loose Pair Training for Multi-modal AMD Categorization
22,Adversarial Domain Adaptation and Pseudo-Labeling for Cross-Modality Microscopy Image Quantification
22,Searching Learning Strategy with Reinforcement Learning for 3D Medical Image Segmentation
22,A Fine-Grain Error Map Prediction and Segmentation Quality Assessment Framework for Whole-Heart Segmentation
22,Computational Modelling of Pathogenic Protein Behaviour-Governing Mechanisms in the Brain
22,Higher Order of Motion Magnification for Vessel Localisation in Surgical Video
22,Star Shape Prior in Fully Convolutional Networks for Skin Lesion Segmentation
22,Direct Automated Quantitative Measurement of Spine via Cascade Amplifier Regression Network
22,Adversarial and Perceptual Refinement for Compressed Sensing MRI Reconstruction
22,Thalamic Nuclei Segmentation Using Tractography Population-Specific Priors and Local Fibre Orientation
22,A Comprehensive Approach for Learning-Based Fully-Automated Inter-slice Motion Correction for Short-Axis Cine Cardiac MR Image Stacks
22,Statistical Framework for the Definition of Emphysema in CT Scans: Beyond Density Mask
22,The Active Atlas: Combining 3D Anatomical Models with Texture Detectors
22,Classification of Pancreatic Cysts in Computed Tomography Images Using a Random Forest and Convolutional Neural Network Ensemble
22,Unsupervised Feature Learning for Endomicroscopy Image Retrieval
22,Deformable Registration of a Preoperative 3D Liver Volume to a Laparoscopy Image Using Contour and Shading Cues
22,Concurrent Segmentation and Localization for Tracking of Surgical Instruments
22,Image-Driven Stochastic Identification of Boundary Conditions for Predictive Simulation
22,Locally Affine Diffeomorphic Surface Registration for Planning of Metopic Craniosynostosis Surgery
22,Automatic Landmark Estimation for Adolescent Idiopathic Scoliosis Assessment Using BoostNet
22,Recognizing Surgical Activities with Recurrent Neural Networks
22,Myocardial Segmentation of Contrast Echocardiograms Using Random Forests Guided by Shape Model
22,Feature Selection Based on Iterative Canonical Correlation Analysis for Automatic Diagnosis of Parkinson’s Disease
22,Sub-category Classifiers for Multiple-instance Learning and Its Application to Retinal Nerve Fiber Layer Visibility Classification
22,Regression Forest-Based Atlas Localization and Direction Specific Atlas Generation for Pancreas Segmentation
22,GraMPa: Graph-Based Multi-modal Parcellation of the Cortex Using Fusion Moves
22,The Minimum Cost Connected Subgraph Problem in Medical Image Analysis
22,Mid-Space-Independent Symmetric Data Term for Pairwise Deformable Image Registration
22,Filling Large Discontinuities in 3D Vascular Networks Using Skeleton- and Intensity-Based Information
22,RF Ultrasound Distribution-Based Confidence Maps
22,Illustrative Visualization of Vascular Models for Static 2D Representations
22,Gated-tracking: Estimation of Respiratory Motion with Confidence
22,Harmonizing Diffusion MRI Data Across Multiple Sites and Scanners
22,Towards an Efficient Computational Framework for Guiding Surgical Resection through Intra-operative Endo-microscopic Pathology
22,Automated Assessment of Surgical Skills Using Frequency Analysis
22,Randomized Denoising Autoencoders for Smaller and Efficient Imaging Based AD Clinical Trials
22,Predicting Fetal Neurodevelopmental Age from Ultrasound Images
22,Spatial Modeling of Multiple Sclerosis for Disease Subtype Prediction
22,Denoising PET Images Using Singular Value Thresholding and Stein’s Unbiased Risk Estimate
22,Simulation of Lipofilling Reconstructive Surgery Using Coupled Eulerian Fluid and Deformable Solid Models
22,Complex Lung Motion Estimation via Adaptive Bilateral Filtering of the Deformation Field
22,Registration of Free-Breathing 3D+t Abdominal Perfusion CT Images via Co-segmentation
22,Separation of Benign and Malignant Glands in Prostatic Adenocarcinoma
22,Robust Myelin Quantitative Imaging from Multi-echo T2 MRI Using Edge Preserving Spatial Priors
22,FLOOR: Fusing Locally Optimal Registrations
22,Non-Local Spatial Regularization of MRI T2 Relaxation Images for Myelin Water Quantification
22,ECONet: Efficient Convolutional Online Likelihood Network for Scribble-based Interactive Segmentation
22,Interpretable and Interactive Deep Multiple Instance Learning for Dental Caries Classification in Bitewing X-rays
